rating,title,text,images,asin,parent_asin,user_id,review_date,helpful_vote,verified_purchase
5.0,Brought back great memories,"If you know this song, you MUST have a copy. Excellent cd; great band. Will bring back wonderful memories.",[],B000P1CTC6,B000P1CTC6,AGQANGDZQGK2IOWOXHOCTPBPQRKA,2016-07-14 14:35:54,1,True
5.0,Fantastic volcalist,Peter Hollens is a truly fantastic vocalist. The singers he has accompanying him on several tracks are also great. The album contains a nice selection of his work.,[],B07DFQRHQ5,B07DFQRHQ5,AENAC6DVZYNNTEGCPUA542BD46VA,2023-02-15 20:53:48,0,False
4.0,enjoyable as background OR foreground music,"howdy y'all,<br /><br />i use this for background music when i am reading. it's quite nifty as foreground music, too! [*grin*] if you like harpsichord music, you will likely enjoy this.<br /><br />take care,<br />lee",[],B0002X4PFG,B0002X4PFG,AE6XLURQ2JFED7NWXHCGH4GQ6OBQ,2015-03-26 04:10:44,1,False
5.0,Five Stars,PERFECT,[],B00DC33KI6,B00DC33KI6,AGH7IQ2Y3DY4I6FXD5KWXIYAN57A,2016-12-28 18:39:59,0,True
5.0,Great,Glad to hear his other music beside the one or two they used to play on the radio back then.,[],B07P1NN9YK,B07P1NN9YK,AGWWTJ2WJXCTXGD3TFDWUUBYOAXQ,2021-11-20 22:25:35,0,True
5.0,Great to See other songs,I only new him by just one songs.  The man put out a lot of great ones and glad I brought the cd.,[],B07FXYHYVQ,B07FXYHYVQ,AGWWTJ2WJXCTXGD3TFDWUUBYOAXQ,2021-11-20 22:24:30,0,True
2.0,Good Comedy,I am used to Redd Foxx when had a red vinyl  This is mostly his stand up comedy at night clubs,[],B01CUWDJCQ,B01CUWDJCQ,AGWWTJ2WJXCTXGD3TFDWUUBYOAXQ,2021-03-12 17:56:30,0,True
5.0,Quick shipping!,Great music,[],B000669EXW,B000669EXW,AFQMW57GEUJGFS6RKLFFPDRNAQFA,2021-04-22 20:51:46,0,True
5.0,Beth is as Good As It Gets,The finest voice I know. As usual her band is tight and the music is perfection! She has the chops!,[],B0019EQCBW,B0019EQCBW,AGW7DNVEEOZ55KAPREK54O7DYLKA,2012-06-29 23:33:07,0,False
5.0,Five Stars,love the eagles,[],B01HXSB2LC,B01HXSB2LC,AF364RSCZMTAEVX533SS37L7G4OQ,2017-08-30 15:52:22,1,True
5.0,Great oldie cd,"When music was really good, and you could sing along with no swearing words. The good Ole days",[],B084J7CCY4,B084J7CCY4,AGS47C3SO62X375JL7RWNBKCFXXA,2021-12-07 07:14:35,0,True
5.0,Love his music,Relaxing music,[],B095JJB6QP,B095JJB6QP,AGS47C3SO62X375JL7RWNBKCFXXA,2021-12-07 07:00:00,0,True
5.0,"Two sessions live at Persian Room in the Plaza Hotel in NYC on September 9, 1958 plus bonus tracks","This is a two-disc set that contains bonus tracks. Refer to my comment to this review for tracks.<br /><br />DISC ONE:  The musicians on the first four tracks were not aware that the tape was rolling and this was never intended to be anything more than a memento of the party. However,it was released as an album on September 28, 1973.<br /><br />The first four tracks of the Miles Davis set were recorded live at the Persian Room in the Plaza Hotel in NYC on September 9, 1958. The sextet features Davis on trumpet, Cannonball Adderley on alto sax, John Coltrane on tenor sax, and a rhythm section led by Bill Evans on piano, Paul Chambers on bass and Jimmy Cobb on drums. This is about six months before the same sextet recorded Kind of Blue.<br /><br />Tracks 5 through 7 were recorded at the Spotlight Lounge in Washington D.C. on November 1, 1958, and the remaining tracks on this disc were recorded Birdland in NYC on January 3, 1959. On all of these bonus tracks Red Garland replaces Evans on piano.<br /><br />DISC TWO: Tracks 1 through 7 were on the original album and also recorded at the Persian Room in the Plaza Hotel in NYC on September 9, 1958. It features Ellington's orchestra that was comprised of Clark Terry, Shorty Baker and Cat Anderson on trumpet, Ray Nance on trumpet and violin, Quentin Jackson, Britt Woodman and John Sanders on trombone, Jimmy Hamilton on clarinet and tenor sax, Russell Procope on alto sax and clarinet, Johnny Hodges on alto sax, Paul Gonsalves on tenor sax, and Harry Carney on baritone sax, bass clarinet and clarinet. The rhythm setion is led by Ellington on piano, Jimmy Woode on bass and Sam Woodyard on drums.<br /><br />Track 5 features Jimmy Rushing on vocals, and track 6 features Billie Holiday on vocals backed by non-Ellington personnel Buck Clayton on trumpet, Mal Waldron on piano and unidentified bassist and drummer.<br /><br />Tracks 8 through 13 feature the main Ellington Orchestra (minus Rushing) and was recorded live at Salle Pleyel, Paris, France on November 20, 1958.",[],B01KBI5GEU,B01KBI5GEU,AG3S4FROO422V5KP7DJCBXVUQLJQ,2016-10-09 16:59:59,4,False
5.0,Evans backed by outstanding rhythm section,"Like the first collaboration between Evans and Manne on the 1962 album titled Empathy, this album has a completely different feel from Evans' other work. Most of the album is uptempo, and while harmony is still Evans' focus, melody and rhythm are given equal attention. I am sure that much of this is due to Shelly Manne's approach to drums, which is always creative), and Eddie Gomez' bass.<br /><br />The sound samples on this page convey the music far better than I can in words, so let those be your guide. I will say that if you are a drummer this is definitely an album you want to dissect. Same for bassists. Gomez is right up there with Scott LaFaro in my opinion. Not a clone, by any means, but still an excellent fit to Evans' playing (which is reinforced by future albums they would do together). Evans is legendary for giving his rhythm section space to stretch and this album is no exception. The breaks and solos by both Manne and Gomez are masterful.<br /><br />This album was recorded for Verve in a single October 4, 1966 session at Rudy van Gelder's Englewood Cliffs, NJ studio. According to some sources (including the liner notes on the LP) there were multiple takes, so the session was probably a trying day. However, each track sounds like spontaneous, effortless art to my ears, so whoever did the post production must have added a lot to the album too.",[],B00005MXBU,B00005MXBU,AG3S4FROO422V5KP7DJCBXVUQLJQ,2016-10-08 01:34:26,1,False
5.0,"Great compositions and arrangements, and a strong rhythm section","At a mere twenty-seven minutes this album is brief. However, every note counts. At the time of this review the album seems to be credited to drummer Philly Joe Jones. It's the brainchild of Elmo Hope. In fact, each of the six songs are Hope's compositions:<br />A1 Hot Sauce 3:35<br />A2 When The Groove Is Low 4:58<br />A3 De-Dah 4:26<br />B1 Abdula 3:42<br />B2 Freffie 3:36<br />B3 Stars Over Marakesh 6:43<br /><br />If you are unfamiliar with Hope's work you are in for a treat. For one thing, despite being classified as a bebop pianist, he is nothing like Bud Powell, Al Haig, Monk, Dodo Marmarosa, etc. Actually, he is closer to Marmarosa than the others mentioned. Moreover, he spent a lot of time in both the NYC and Los Angeles scenes, so he absorbed both styles. Finally, there is a heavy touch of blues, as well as classical in his playing.<br /><br />He is backed on this album by Paul Chambers on bass and Philly Joe Jones on drums. Both are perfect for the arrangements and compositions on the album. I am very familiar with Chambers (especially his work with Red Garland), and am greatly influenced by Jones.<br /><br />This was recorded for the Celebrity label in NYC in 1961. I was unable to nail down an exact date or studio. I suspect that this was recorded in a single session since many albums (and especially ones as short as this one) were one day affairs. I would appreciate any additional information, which you can place in a comment.",[],B010U5EZMI,B010U5EZMI,AG3S4FROO422V5KP7DJCBXVUQLJQ,2016-10-02 04:13:32,0,False
5.0,One of two solo tribute albums Waldron recorded in the 1970s,"This is another of my vinyl treasures because it features Waldron solo. Another big plus is the sound quality is far better than I expected considering my LP is in Good to VG condition. Every note is crystal clear. This is especially impressive considering that this was recorded live.<br /><br />There are only four tracks, but the album still clocks in at a respectable 37:08. Granted, the LP could have held more, but I am not complaining because this is the only recording I own of Waldron solo.<br /><br />Since there is no track list, I am including it here:<br /> A1 Mingus Lives 7:48<br />A2 Snake Out 10:42<br />B1 Tensile Structure 7:54<br />B2 Here, There and Everywhere 10:44<br /><br />The entire album is comprised of Waldron compositions. This is the second tribute album he recorded for former bandleaders. The first was Blues for Lady Day (also solo) in 1972 and this one. This was recorded for the Enja label at the Chapati Club in Spa, Belgium on February 28, 1979.",[],B00414B2YO,B00414B2YO,AG3S4FROO422V5KP7DJCBXVUQLJQ,2016-09-29 02:51:38,0,False
5.0,"Anita in top form in her later career, with great arrangements and backing","This is not an essential album, but does have some excellent arrangements thanks to Roger Neumann's tenor and soprano sax, and flute. His addition to the ensemble adds an extra dimension to Anita's vocals over and above her typical jazz piano trio backing.<br /><br />Ao vivo means live in Portuguese; this album was recorded live for the Estudio Eldorado label at the 150 Night Club located in the Maksoud Plaza Hotel in São Paulo, Brazil on August 21 and 22, 1984. Anita's voice on this album is still in good form, and her vocals are delivered with her trademark rhythmic intensity. The sound quality is above average.<br /><br />In addition to Neumann she is backed by Harold Danko on piano, Rick Laird on bass and longtime collaborator John Poole on drums. They are tight and back her perfectly. Here are the tracks:<br />A1  Wave  3:36<br />A2  It Had To Be You  3:44<br />A3  Sleeping Bee  3:38<br />A4  Time After Time  4:30<br />A5  Stomping At The Savoy  4:26<br />A6  P-Town  0:48<br />B1  The Man With The Horn  3:28<br />B2  Body And Soul  6:04<br />B3  Lush Life  3:44<br />B4  The Song Is You  3:49<br />B5  Wave  2:01<br /><br />This isn't what I would consider an essential album, but for we fans the recording quality and performances make it a worthwhile buy.",[],B008YNTE8Y,B008YNTE8Y,AG3S4FROO422V5KP7DJCBXVUQLJQ,2016-08-27 20:57:04,0,False
5.0,Early Previn in jazz,"Up front, a good copy of this album in vinyl has excellent sound quality, but I want to disclose that to my ears the arrangements are a little too heavy and a little too busy. I am not going to subtract a star because of it because the musicianship is superb and my personal taste should not enter into the equation.<br /><br />There are some redeeming moments in this album. Specifically, everything that Previn plays is beyond reproach and I think that is something to which any listener would agree.  I also loved Bud Shank's flute work on the tracks on which he played that instrument. In fact, the entire wind section (Shank on alto and flute, Jimmy Giuffre on baritone, and Bob Cooper on tenor and soprano) are uniformly excellent throughout. Milt Bernhart's trombone and Shorty Rogers' trumpet were well played, but I think the trombone in particular was a too low for the arrangements, and Rogers was a bit on the busy side.<br /><br />Shelly Manne is the drummer on all tracks, but the bassists are Joe Mondragon ( tracks A1-A3, A5, B1-B3 and B5), with Curtis Counce on the remaining tracks. Jack Marshall is on guitar on tracks A1 and A2, and B1 and B2, with Al Hendrickson on the remaining tracks.<br /><br />The tracks on this album that clocks in at 35:14 are:<br />A1  It's Delovely<br />A2  Porterhouse<br />A3  Heat Wave<br />A4  40° Below<br />A5  You Stepped Out Of A Dream<br />A6  Claudia<br />B1  You Do Something To Me<br />B2  Call For Cole<br />B3  Everything I've Got<br />B4  Some Antics<br />B5  It Only Happens When I Dance With You<br />B6  General Cluster<br /><br />Previn is the composer for tracks A2, A4 and A6, with Rogers getting composer credits for tracks B2, B4 and B6. The remaining tracks are standards by the usual suspects (Porter, Berlin, Hart, Rogers, Kahn et al.) This album was recorded for RCA Victor at over the course of three sessions at their Los Angeles studios in 1954: March 30 (tracks 3, 5, 9 and 11), June 14 (tracks 4, 6, 10 and 12), and September 14, (tracks 1, 2, 7 and 8.)",[],B01AH8H336,B01AH8H336,AG3S4FROO422V5KP7DJCBXVUQLJQ,2016-08-25 22:29:37,0,False
5.0,Evidence of Previn's jazz chops,"This is one of my thrift shop finds (the vinyl was in pristine condition!) This album proves beyond a doubt that Previn's jazz chops are considerable. All songs are penned by Loewe & Lerner, but it's the way Previn arranged them for a jazz piano trio that is a mark of his genius (as well as his and his rhythm sections performance.) There are places where you can hear Ahmad Jamal's influence. Indeed, at one point on A3 (A Toujours) the trio sounded like the Jamal/Crosby/Fournier line-up from their Pershing album. In other tracks it's pure Previn with both Manne's and Mitchell's signature styles.<br /><br />Since there is no track list as I write this, there is what comprises the 38:54 minutes on the album:<br />A1  The Parisians  4:32<br />A2  I Remember I Will  4:30<br />A3  A Toujours  5:38<br />A4  It's A Bore  4:18<br />B1  Aunt Alicia's March  5:01<br />B2  Thank Heaven For Little Girls  4:31<br />B3  Gigi  5:39<br />B4  She Is Not Thinking Of Me  4:09<br /><br />As a drummer the stand out for me is Shelly Manne's brushwork, but I also love Red Mitchell's bass, and, of course, Previn's approach to piano (and arranging). The trio is tight and the way they are all three locked in, yet all three participating, make this as instructive as it is enjoyable.<br /><br />This was recorded for the Contemporary label in their Los Angeles studios on April 7 and 8, 1958.  This is West Coast jazz at its best, and a showcase for Previn's versatility.",[],B00B9JSBFC,B00B9JSBFC,AG3S4FROO422V5KP7DJCBXVUQLJQ,2016-08-25 21:45:26,1,False
4.0,"Not optimal for camping, but definitely effective in other uses","I received these as a free review sample. Before you read my observations take the time to check out  Tom's very thorough and helpful video review dated April 5, 2016.<br /><br />These are far better suited to home use than camping in my opinion for a number of reasons. Foremost (and why I subtracted a star) is they are not easy to start, even with a lighter, and secondary, they are heavy. For campers a box of these is extremely heavy (for camping) and add almost nine pounds to carrying weight.<br /><br />For starting fire places, wood stoves and grills and even charcoal grills these are excellent. More importantly, these work beautifully in hibachi style grills and they do last the claimed amount of time.<br /><br />Despite my caveat about these being less than optimal for camping, one or two in a backpack are a good hedge against an emergency. Just be prepared to first build a kindling fire and build on that before lighting one of these pucks because you are not going to directly get one started with a firestick.",[],B01BBSGZIK,B01BBSGZIK,AG3S4FROO422V5KP7DJCBXVUQLJQ,2016-04-12 04:22:12,10,False
5.0,Previn's jazz chops are in evidence here,"This album is yet another of my thrift shop finds. The mystery is on the cover it's credited as Piano Solos With Instrumental Accompaniment. I took that as a challenge because there were no hints in the liner notes as to who was backing him. I pretty much suspected Red Mitchell on bass and Shelly Manne on drums, but beyond that had no clue. I managed to track down the dates and personnel on each track, which I will provide below.<br /><br />First, you can listen to the tracks on a larger compilation made up of albums and tracks from the same era: [[ASIN:B008FTAH2O Previn's Touch]]. Run through the sound samples and you will be treated to a display of Previn's jazz chops. Although he had the touch and feel for classical, and the innate sensibility for sound tracks and scores, he was a first rate jazz musician, but his other work (and the fact that he was in the West Coast scene) overshadowed that. This album is evidence that he was the real thing in jazz too.<br /><br />Here is the track list, which is missing at the time I am writing this:<br />A1  Flying Down To Rio  2:30<br />A2  You Are Too Beautiful  3:19<br />A3  When You Wish Upon A Star  2:05<br />A4  London In July  3:25<br />A5  Moonlight In Vermont  3:18<br />A6  Island In The West Indies  3:29<br />B1  How Are Things In Glocca Morra  3:43<br />B2  It Could Happen To You  3:03<br />B3  Honolulu  2:51<br />B4  My Foolish Heart  2:11<br />B5  But Beautiful  3:11<br />B6  Sidewalks Of Cuba  2:24<br /><br />It took some sleuthing to discover who was backing him. All of the tracks were recorded for the Decca label in Los Angeles in April 1955 and March 1956. Here are the sessions and musicians in chronological order:<br /><br />April 1955 has Previn backed by Al Hendrickson on guitar, Red Mitchell on bass and Irv Cottler on drums:<br />Track B1: April 11.<br />Tracks A1,A4 and A6: April 13.<br />Tracks A5, B3 and B6: April 18.<br /><br />March 1956 has Previn backed by Al Hendrickson on guitar, Carson Smith on bass and Shelly Manne on drums:<br />Tracks B2 and B5: March 28.<br />Tracks A2, A3 and B4: March 29.<br /><br />This album was released by Decca as DL 74350 in 1963 and clocks in at 35:35. If you are a pianist or a West Coast jazz fan this is a great album.",[],B0033Q1W8W,B0033Q1W8W,AG3S4FROO422V5KP7DJCBXVUQLJQ,2015-12-26 18:08:03,3,False
5.0,Dinah Washington plus two instrumental tracks from NJF 58,"This is yet another of my thrift shop finds. What caught my eye is this album contains the iconic track that was captured on video by Bert Stern, [[ASIN:B00003OSU4 Jazz on a Summer's Day]], which is track A4 on this LP. Since the tracks are not listed at the time I am writing this, here they are:<br />A1 Lover Come Back To Me 2:16<br />A2 Back Water Blues 4:33<br />A3 Crazy Love 3:27<br />A4 All Of Me 5:18<br />B1 Backstage Blues 9:10<br />B2 Julie And Jake 8:40<br /><br />The entire album was recorded live at the Newport Jazz Festival on July 6, 1958. All of Side A features Dinah Washington, but Side B contains only instrumentals. The first three tracks of Side A are: Dinah Washington backed by Blue Mitchell on trumpet, Melba Liston on trombone (and arranger), Harold Ousley on tenor sax and Sahib Shibab on baritone sax. The rhythm section is Wynton Kelly on piano, Paul West on bass and Max Roach on drums.<br /><br />Track A4 is a change up with Washington backed by Don Elliott on mellophone, Urbie Green on trombone, Terry Gibbs (and briefly Washington) on vibraphone, with the same rhythm section.<br /><br />Side B is Don Elliott on mellophone, Urbie Green on trombone, Terry Gibbs on vibraphone and the same rhythm section as Side A.",[],B00B6H7E8W,B00B6H7E8W,AG3S4FROO422V5KP7DJCBXVUQLJQ,2015-12-17 17:21:31,0,False
5.0,Essential for Art Pepper and West Coast Jazz fans,"Up front: the sound quality is acceptable, but not up to audiophile standards. I have no complaints, but if you are a discriminating listener with a lot of money in audio gear you may want to look elsewhere.<br /><br />Nine of the ten discs span the period between 1952 and 1959, with one disc from 1981, the year before Art passed. It's difficult to pick a favorite disc, and that is subjective anyway. What I'll do is list the number of tracks on each, when and where the tracks were recorded, and on as many as I can, the musicians on the tracks.<br /><br />Also note that each disc sleeve has a title as well. Those titles do not map to specific albums, although it's easy to extrapolate some albums from which the tracks came by noting the dates, personnel and tracks. I'll list each track in a comment to this review.<br /><br />DISC ONE: 11 tracks.<br />Sleeve title is Diablo's Dance. Recorded in 1957 in Los Angeles. Appears to be Art on tenor, with Red Garland on piano, Paul Chambers on bass and Philly Joe Jones on drums from the sessions that produced Art Pepper Meets The Rhythm Section.<br /><br />DISC TWO. 11 tracks.<br />Sleeve title is Long Ago and Far Away. Recorded in 1956 and 1957 in Los Angeles. Personnel include the following ensembles backing Art:<br />Carl Perkins (piano), Ben Tucker (bass) and Chuck Flores (drums)<br />Russ Freeman (piano), Ben Tucker (bass) and Chuck Flores (drums)<br />Russ Freeman (piano), Leroy Vinnegar (bass) and Shelly Manne (drums)<br />Gerry Wiggins (piano), Red Norvo (vibraphone), Ben Tucker (bass) and Joe Morello (drums)<br /><br />DISC THREE. 12 tracks.<br />Sleeve title is Angel's Wings. Recorded in Los Angeles in 1956 and 1957. Personnel include the following ensembles backing Art:<br />Russ Freeman (piano), Jack Sheldon (trumpet), Leroy Vinnegar (bass) and Shelly Manne (drums)<br />Russ Freeman (piano), Ben Tucker (bass) and Chuck Flores (drums)<br />Gerry Wiggins (piano), Red Norvo (vibraphone), Ben Tucker (bass) and Joe Morello (drums)<br />Carl Perkins (piano), Ben Tucker (bass) and Chuck Flores (drums)<br /><br />DISC FOUR. 13 tracks.<br />Sleeve title is Blues In. Recorded in Los Angeles between 1952 and 1957. Unable to track down the backing musicians.<br /><br />DISC FIVE. 10 tracks.<br />Sleeve title is Pepper Blues. Recorded in Los Angeles between 1952 and 1957. Backing musicians are:<br />Red Garland (piano), Paul Chambers (bass) and Philly Joe Jones (drums)<br />Hampton Hawes (piano), Joe Mondragon (bass) and Larry Bunker (drums and vibraphone)<br /><br />DISC SIX. 4 tracks.<br />Sleeve title is Road Waltz. Recorded in Los Angeles in 1981 (a year before Art's passing). George Cables (piano), David Williams (bass) and Carl Burnett (drums). Art is on clarinet on When You're Smiling.<br /><br />DISC SEVEN. 10 tracks.<br />Sleeve title is Art Pepper Big Band. Recorded in Los Angeles in 1959. Unable to track down the backing musicians.<br /><br />DISC EIGHT. 9 tracks.<br />Sleeve title is Art Pepper & Marty Paich Quartet. This disc is identical to The Marty Paich Quartet Featuring Art Pepper, which was recorded in Los Angeles in 1956 and features Marty Paich on piano, Buddy Clark on bass and Frank Capp on drums backing Art on alto.<br /><br />DISC NINE. 12 tracks.<br />Sleeve title is Spices. Recorded in Los Angeles in 1954 and features the following backing musicians:<br />Jack Montrose (ténor), Claude Williamson (piano),; Monty Budwig (bass) and Paul Ballerina (drums)<br />Hampton Hawes (piano), Joe Mondragon (bass) and Larry Bunker (drums)<br />Jack Montrose (ténor), Claude Williamson (piano), Monty Budwig (bass) and Larry Bunker (drums)<br /><br />DISC TEN. 12 tracks.<br />Sleeve title is With Mel Torme & Marty Paich Quartet. Recorded in Los Angeles in 1959. Some featured musicians include Jack Shelton on trumpet, Victor Feldman on vibraphone, Marty Piach on piano and Mel Torme on vocals.<br /><br />To me this set is a valuable collection of one of the most lyrical alto saxophonists in jazz. Art is among my top three favorite alto players - the other two are Johnny Hodges and Paul Desmond. Please see the comment below for the complete track list, which will give clues about the albums and recording sessions from which they came.",[],B00FZ15A90,B00FZ15A90,AG3S4FROO422V5KP7DJCBXVUQLJQ,2015-12-12 21:28:42,2,False
5.0,An obscure gem from an obscure musicial - fun listen,"This gem is one of my thrift shop finds. It's based on a 1959 Broadway musical that enjoyed 452 performances at the 46th Street Theatre. The music on this album mimics the play in that it's relatively obscure, but enjoyable. This album is from an era when soundtracks from plays and musicals were very popular.<br /><br />This one has a slight Dixieland feel to it, and because it is performed by a sextet instead of a full orchestra is interestingly arranged. When researching this album an interesting (but unverified) tidbit surfaced: the ensemble did not rehearse - they walked into the studio and 'had fun' creating the tracks that were selected for this album from among the eighteen that were actually performed in acts I and II in the play itself. Here are the tracks on this album and their lengths. The entire album clocks in at 33:36:<br />A1  My Girl Is Just Enough For Me  4:05<br />A2  Just For Once  2:22<br />A3  I Feel Mighty Marvelous  3:54<br />A4  The Right Finger Of My Left Hand  2:27<br />A5  Look Who's In Love  3:30<br />B1  Uncle Sam Rag  3:52<br />B2  Two Faces In The Dark  3:25<br />B3  I'm Back In Circulation  2:45<br />B4  Erbie Fitch's Dilemma  2:01<br />B5  Pick Pocket Tango  4:15<br />That's still almost two thirds of the actual songs from the play. All are catchy and nicely interpreted and performed. My favorite is B5, but I love songs with a tango feel. I cannot begin to describe the music since words are inadequate, but if you like more traditional jazz that is more easy listening and commercial, this is an interesting album and a fun listen.<br /><br />This was originally recorded for the Design Records label in 1959 and features Rex Stewart on trumpet backed by  John Bunch on piano, Joe Venuto on marimba, Leonard Gaskin on bass and Mousey Alexander on drums.",[],B003MXXFSQ,B003MXXFSQ,AG3S4FROO422V5KP7DJCBXVUQLJQ,2015-12-08 15:56:13,0,False
