rating,title,text,images,asin,parent_asin,user_id,review_date,helpful_vote,verified_purchase
5.0,Both as a leader and as a sideman,"This four album set comes on two discs and features Flanagan's first album as a leader, and the rest as either co-leader or sideman. The sound quality is very good. I have come to trust this label for putting together competently remastered sets of albums that are mostly out of print.<br /><br />The tracks are not in chronological order, but they are grouped by the source albums from which they are taken. Also, the albums are as originally issued. There may be re-releases that have bonus tracks, but this set does not.<br /><br />Disc One starts off with an album titled Jazz...It's Magic! that was recorded for the Regent label at Rudy van Gelder's Hackensack, NJ studio on September 5, 1957. It's credited as the Curtis Fuller-Tommy Flanagan Quintet and features Fuller on trombone and Sonny Redd on alto sax, backed by Flanagan on piano, George Tucker on bass and Louis Hayes on drums. The tracks are:<br />1. Two Ton<br />2. Medley (It's Magic/My One And Only/They Didn't Believe Me)<br />3. Soul Station<br />4. Club Car<br />5. Upper Berth<br /><br />Remaining tracks are from the album titled The King and I that was recorded by the Wilbur Harden Quartet in NYC for the Savoy label on September 23 and 30, 1958. Hardin is on trumpet and flugelhorn backed by Flanagan on piano and celeste, George Duvivier on bass and Granville Hogan on drums. Tracks are:<br />6.  Getting To Know You<br />7.  My Lord And Master<br />8.  Shall We Dance<br />9.  We Kiss In A Shadow<br />10. I Have Dreamed<br />11. I Whistle A Happy Tune<br />12. Hello Young Lovers<br />13. Something Wonderful<br />14: `Trio Overseas'<br />14. Relaxin' At Camarillo<br /><br />Disc Two starts off Trio Overseas, which is Flanagan's first album as a leader. It  was recorded for the Metronome label in Stockholm, Sweden on August 15, 1957. Flanagan is backed by Wilbur Little on bass and Elvin Jones on drums. Tracks are:<br />1. Chelsea Bridge<br />2. Eclypso<br />3. Beats Up<br />4. Skal Brothers<br />5. Little Rock<br />6. Verdandi<br />7. Dalarna<br />8. Willow Weep For Me<br /><br />Tracks 9 through 13 are the album titled The Cats that was recorded for the New Jazz and Prestige labels at Rudy van Gelder's Hackensack, NJ studio on April 18, 1957. This album is credited to the Prestige All Stars and features Flanagan as co-leader. The line-up is Idrees Sulieman on trumpet with John Coltrane on tenor sax, backed by Flanagan on piano, Kenny Burrell on guitar, Doug Watkins on bass and Louis Hayes on drums. Tracks are:<br />9.  Minor Mishap<br />10. How Long Has This Been Going On?<br />11. Eclypso<br />12. Solacium<br />13. Tommy's Time",[],B013H289UA,B013H289UA,AG3S4FROO422V5KP7DJCBXVUQLJQ,2015-10-10 12:48:22,0,False
5.0,Wonderful pairing,"This is the first of four collaborations between Peterson and Jackson and it presages the ones to come. At a few seconds short of forty one minutes this album is almost a tease.<br /><br />One of the nice things about this album is it has some of the restraint Jackson used with the Modern Jazz Quartet. However, Peterson's piano is a major contrast to John Lewis' of the MJQ and that contrast makes this album interesting. For one thing, Peterson and bassist Ray Brown were renown for intensity even on ballads, and drummer Ed Thigpen fit right into that as well.<br /><br />Despite my alluding to intensity, the music comes across as relaxed and laid back. They made it sound so easy! When you closely listen the intensity is there under a layer of virtuosity and musicality. This is Jackson and Peterson's trio at their finest in my opinion.<br /><br />Since there is no track list (as I write this) I am providing one for reference:<br />1. On Green Dolphin Street 7:32<br />2. Heartstrings  5:43<br />3. Work Song 7:35<br />4. John Brown's Body 7:49<br /> 5. A Wonderful Guy 4:57<br /> 6. Reunion Blues<br /><br />The album was recorded for Verve in NYC over the course of two sessions (September 15 and 18, 1961.)  Sadly there were five unissued tracks from the sessions, two of which are logged as 'untitled Peterson originals' that I would have loved to have been included in a reissue. Regardless, the music that is on this album is definitely worthwhile.",[],B00YBKPGYU,B00YBKPGYU,AG3S4FROO422V5KP7DJCBXVUQLJQ,2015-10-01 18:44:13,0,False
3.0,"Not essential and Baker not at peak, but still enjoyable","This recording was made for the Belgium Philippe Defalle label in November 1979 in Brussles.<br /><br />I subtracted two stars because Baker's vocals are very weak here. His performances during this period were always hit or miss and this was must have caught him on a bad day. His trumpet work, though, does not suffer in the least. He is in full command of that instrument.<br /><br />There is no track list at the time of this review, so I am providing one and the times for each track:<br />01. This is always  7:49<br />02. Sweet Martine  8:20<br />03. Beatrice  6:49<br />04. Deep in a dream  5:53<br />05. Once I loved  4:51<br /><br />The album itself is somewhat pensive, with a laid back feeling among the entire ensemble. The instrumental sections are tight as though rehearsed a few times. I am not sure that was actually the case, but that is one of the key strengths of this album and what makes it so enjoyable. There is a touch of Baker's good days in those parts of the album.<br /><br />Another interesting thing is this does not come across as a hastily thrown together session. The ensemble is fairly large for Baker during this era in his career. He is accompanied by Steve Houben on alto sax, and backed by a solid rhythm section comprised of  Dennis Luxion on piano (credited as Denis Luxion) Bill Frisell on guitar, Kermit Driscoll on bass and Bruno Castellucci on drums. In particuar Houben, Luxion and Frisell stand out,  while Driscoll and Castellucci are solid on pulse and time. No complaints with any member of the ensemble or the sound quality of this CD.",[],B004NQQ5TC,B004NQQ5TC,AG3S4FROO422V5KP7DJCBXVUQLJQ,2015-09-19 12:34:03,1,False
5.0,"2 LPs, 1 track per side of great music","This is actually a studio album that was put together by Granz as a recorded (and supervised) jam. The line-up is first rate, and has a large alto and tenor saxophone section, fronted by Charlie Shavers on trumpet and backed by a solid rhythm section.<br /><br />Basically, this is along the lines with one of Granz' Jazz At The Philharmonic sessions. Here are the tracks:<br />A Jam Blues 14:39<br />B Ballad Medley 17:21<br />C What Is This Thing Called Love 15:48<br />D Funky Blues 13:26<br /><br />A and B are LP #1 and C and D are the second LP. If you find this set in VG condition the sound quality is superb. As can be seen from the track times each song is an extended rendition of a standard, with the obligatory ballad medley. Funky Blues is a Johnny Hodges composition, and the Ballad Medley is comprised of the following: All The Things You Are, Dearly Beloved, The Nearness Of You, I'll Get By, Everything Happens To Me, The Man I Love, What's New?, Someone To Watch Over Me and Isn't It Romantic?<br /><br />The line-up is a front line featuring Charlie Shavers on trumpet, accompanied by an alto sax section comprised of Johnny Hodges, Charlie Parker and Benny Carter, and a tenor sax section comprised of Flip Phillips and Ben Webster. The rhythm section was led by the Oscar Peterson Trio (Peterson on piano,  Barney Kessel on guitar and Ray Brown on bass), and J. C. Heard on drums.<br /><br />This album was originally released on both Mercury and Clef, then by Verve. It was recorded at Radio Recorders in Los Angeles on June 17, 1952 (some discographies cite July 1952.<br /><br />If you are familiar with JATP sessions from this era you already have an idea how this will sound. To my ears it's a fantastic reminder that folks were making some great music sixty-three years ago.",[],B001COGBU6,B001COGBU6,AG3S4FROO422V5KP7DJCBXVUQLJQ,2015-09-09 19:26:52,5,False
5.0,Two full albums + bonus tracks,"This is a great two album set with two additional tracks from a third album. The interesting thing is tracks 13 through 18 are Burrell's first album as a leader, and the first twelve tracks feature him on vocals as well as guitar.<br /><br />Since there is no track list as I write this I am providing it for reference:<br />1.  I'll Buy You A Star<br />2.  Weaver Of Dreams<br />3.  The More I See You<br />4.  I'm Just A Lucky So And So<br />5.  A Fine Romance<br />6.  Until The Real Thing Comes Along<br />7.  The Blues Is Awful Mean<br />8.  That Old Feeling<br />9.  If I Had You<br />10. Hootchie-Koo<br />11. Afternoon In Paris<br />12. Like Someone In Love<br />13. This Time The Dream's On Me<br />14. Fugue'n Blues<br />15. Takeela<br />16. Weaver Of Dreams<br />17. Delilah<br />18. Blues For Skeeter<br />19. Get Happy<br />20. But Not For Me<br /><br />The music is what you would expect from Burrell who was a veteran player when his inaugural album was recorded in 1956. He is backed by some of the best NYC musicians of the era, and that, too, indicates the high standard of music on this album. Add in the fact that the sound quality is superb for a CD and this album is a winner all around.<br /><br />Tracks 1 through 12 were recorded for Columbia in NYC in four different sessions between October 18, 1960 and April 11, 1961. These tracks feature Burrell on both guitar and vocals. He has a similar singing voice to Nat King Cole who I am guessing inspired him. It's a pity Burrell didn't sing more on other albums because his voice is excellent.<br /><br />Tracks 1, 2 and 9 were recorded on March 1, 1961 with Burrell accompanied by Bobby Jasper on tenor sax and backed by  Tommy Flanagan on piano, Wendell Marshall on bass and Bobby Donaldson on drums.<br /><br />Tracks 3, 4, 7 and 12 were recorded on November 1, 1960 with the same line-up with a few changes on specific tracks. On track 7 Joe Benjamin is on bass and Bill English is on drums.<br /><br />Tracks 5, 6 and 8 were recorded on October 18, 1960 with Burrell accompanied by Bobby Jasper on tenor sax and flute, and backed by Wendell Marshall on bass and Bobby Donaldson on drums.<br /><br />Tracks 10 and 11 were recorded on April 11, 1961 with Burrell accompanied by Bobby Jasper on tenor sax and backed by a rhythm section comprised of Tommy Flanagan on  piano, Joe Benjamin on bass and Bill English on drums.<br /><br />Tracks 13 through 18 are the album titled [[ASIN:B004ADWXTY Introducing Kenny Burrell]] that was recorded on May 29 and 30, 1956 for Blue Note at Rudy Van Gelder's Hackensack, NJ studio. Kenny's guitar is backed by Tommy Flanagan on piano, Paul Chambers on bass, Kenny Clarke on drums and Candido Camero on congas.<br /><br />Tracks 19 and 20 are from the album titled Kenny Burrell, Vol. 2, which was a follow-on to Introducing Kenny Burrell. These two tracks were recorded during the same May 29 and 30 1956 sessions with the same line up on track 19. He is solo on track 20.",[],B00KJJRZWI,B00KJJRZWI,AG3S4FROO422V5KP7DJCBXVUQLJQ,2015-08-25 18:38:19,2,False
5.0,For the West Coast jazz fan,"This album has a WWI theme because the song selection was chosen for their popularity during the 19-teens. Many of the songs are timeless, like track 1, After You've Gone. Others have fallen into obscurity, but when this album was recorded in 1957 many were still in the public's mind since WWI ended less than forty years prior. Note that the last track, Vamp's Blues, was written by Charlie Mariano who was not born until after the war (in 1923). Still, the overall theme of this album, with a distinct West Coast flavor, is what drew me to it.<br /><br />Since there is no track list on this page (at the time of this review) I am including it here:<br />1.  After You've Gone 4:49<br />2.  When Johnny Comes Marching Home 5:13<br />3.  Deep River 5:40<br />4.  Till We Meet Again  4:15<br />5.  K-K-K-Katy 5:27<br />6.  'til The Clouds Roll By 2:39<br />7.  Over There  4:22<br />8.  Ja Da 4:17<br />9.  Hello, Central, Give Me No Man's Land  3:57<br />10. Vamp's Blues  7:05<br /><br />The entire album clocks in at 48:14 and you can listen to sound samples on a reissue of this album at [[ASIN:B008C7POJ0 The Vamp's Blues]]. Let those guide you because they convey a lot more about this album than I can possibly put into words.<br /><br />This was recorded in Los Angeles for the World Pacific label at the Radio Recorders studio on December 10 and 11, 1957. Charlie Mariano is on alto sax (and recorder on Deep River), Jerry Dodgion is on alto sax and flute, Victor Feldman is on vibraphone, Jimmy Rowles on piano, Monty Budwig on bass and Shelly Manne on drums.",[],B004R74GMU,B004R74GMU,AG3S4FROO422V5KP7DJCBXVUQLJQ,2015-08-08 12:28:52,2,False
5.0,One-of-a-kind performance,"I discovered this album in near pristine condition at a local thrift shop and it was love at first listen. I have been both an avid Paul Desmond and Modern Jazz Quartet for for decades. While members of the MJQ often were on other albums (both bassist Percy Heath and drummer Connie Kay were on Desmond-led albums), and Milt Jackson was prolific as a sideman with other groups they were a closed unit. Being invited to site in was a signal honor for Desmond, and that they were musically on the same page is evident when listening to this album.<br /><br />Sadly there are no sound samples on this page, although of you scour the web you will find some of the tracks from this album. Desmond's slow, dynamically soft playing is a perfect fit. I am especially impressed with John Lewis on piano and Jackson on vibraphone who seemed to be connected to Desmond on a one of those rare levels that we musicians experience. The rhythm section is absolutely perfect here. This is a major contrast to the Dave Brubeck Quartet rhythm section, which was Desmond's home for nearly twenty years.<br /><br />Also missing from this page is the track listing. I am including it and track times so you know what this album contains:<br />SIDE A<br />A1 Greensleeves 3:10<br />A2 You Go To My Head 7:56<br />A3 Blue Dove/La Paloma Azul 4:55<br />A4 Jesus Christ Superstar 4:54<br />SIDE B<br />B1 Here's That Rainy Day 4:50<br />B2 East Of The Sun 8:25<br />B3 Bags New Groove 5:10<br /><br />Think of this as the MJQ with a special guest (which, of course it is), because John Lewis holds the reins tightly on this live album. However, in this case he did not have to rein in Desmond who was so perfectly suited to the MJQ that one has to wonder why there is only a single collaboration between him and the entire quartet. This is definitely an album to own!",[],B0031H4NU2,B0031H4NU2,AG3S4FROO422V5KP7DJCBXVUQLJQ,2015-07-25 11:52:45,1,False
5.0,Decent sound quality for live radio broadcasts,"This album is parts of two separate radio broadcasts - one from the Basin Street East in NYC and the other from the Blue Note Club in Chicago.  The sound quality is surprisingly good considering all of the tracks are live and in a live setting. The announcements either add to the ambiance or wreck the album, depending on your point of view. For me I actually like them. You may have other thoughts, but at least you know that a lot of the broadcast has not been edited out.<br /><br />Since there is no track list at the time of this review I am providing one:<br />1.  Theme (The Duke) & Introduction<br />2.  Stardust<br />3.  Gone With The Wind<br />4.  Stompin' for Mili<br />5.  Out of Nowhere (Incomplete)<br />6.  A Minor Thing<br />7.  In Your Own Sweet Way<br />8.  The Trolley Song<br />9.  Introduction & The Duke<br />10. Love Walked In<br />11. Here Lies Love<br />12. All the Things You Are<br />13. Theme (The Duke) And Introduction<br />14. I'm In A Dancing Mood<br />15. The Song Is You<br /><br />Tracks 1 through 12 - the bulk of this album - are from the February 1956 engagement(s) at the Basin Street East. I am not sure of the date or dates and each discography I have checked does not provide exact details. The line-up is the one before the classic Wright/Morello rhythm section joined the quartet. This one has Dave Brubeck on piano, Paul Desmond on alto sax, Norman Bates on bass and Joe Dodge on drums.<br /><br />The last three tracks are from the March 1957 engagement at the Blue Note Club. Joe Morello had replaced Joe Dodge by the time these tracks were recorded and may, in fact, be the first recorded tracks with the Quartet featuring Joe Morello.<br /><br />Some of the tracks on this album are on other live compilations, but not all of them. Frankly this is not what I would consider an essential album, but it is definitely worth it if you are a fan.",[],B005B6UL5M,B005B6UL5M,AG3S4FROO422V5KP7DJCBXVUQLJQ,2015-07-25 10:51:10,1,False
5.0,OP circa 1950,"This album shares a lot with [[ASIN:B000CCB1PE Keyboard]] because it features Peterson in a duo with a bassist (two, in fact, with both Major Holley and Ray Brown swapping depending on the track). Also, some of the tracks for both albums were recorded during the same session.<br /><br />Since there is no track list at the time of this review I am providing what the CD contains:<br />1.  Debut 2:52<br />2.  They Didn't Believe Me 2:55<br />3.  Lover, Come Back to Me 2:51<br />4.  Where or When  3:27<br />5.  Three O'Clock in the Morning  3:39<br />6.  All the Things You Are  3:36<br />7.  Tenderly  3:46<br />8.  Oscar's Blues  3:14<br />9.  Little White Lies  3:09<br />10. In the Middle of a Kiss  3:13<br />11. Nameless  2:55<br />12. Two Sleepy People  3:18<br /><br />Total play time is a little over 40 minutes, which was long for 1950 when this album was recorded. Although there are no sound samples, each track sounds like Peterson solo with the underpinnings of bass. When I first listened I though he was solo and playing some remarkable stuff with his left hand. Given his prowess that is not a stretch, but on the first eight tracks the bass is Ray Brown and on the remaining four it's Major Holley. The Peterson/Brown tracks were recorded in NYC for the Clef label during March 1950. I was never able to track down specific dates, but it does place the session a year or so away from Peterson's first trio featuring Brown on bass and Herb Ellis on guitar. The last four tracks were recorded on May 8, 1950 in NYC during the same session that produced Keyboard mentioned above.<br /><br />The mastering on this CD is excellent and audiophile quality. If you are willing to go budget this album is also available in a budget-priced, ten disc set titled [[ASIN:B00KBZ74O4 Oscar Peterson & Friends]]. The sound quality of that one is good, but nowhere near the quality of this CD.",[],B00PBN414W,B00PBN414W,AG3S4FROO422V5KP7DJCBXVUQLJQ,2015-07-08 22:08:10,2,False
5.0,"Not essential, but a gem for Davis fans","I love this album mainly for the collaboration between Milt Jackson and Miles, but I have to give due credit to McLean's contributions too. Not only is his playing masterful, but Dr. Jackle and Minor March are his compositions. Ray Bryant contributed a composition as well: Changes. The remaining track is a Thad Jones composition that somehow got slipped into the track list.<br /><br />At the time of this review there is no track list on this product page, The album clocks in a scant 31 minutes with the following four tracks:<br />01 Dr. Jackle<br />02 Bitty Ditty<br />03 Minor March<br />04 Changes<br /><br />Ray Bryant is another reason why I love this album. I own a large number of his albums and his playing here does not disappoint. Credit is also due Percy Heath on bass and Art Taylor on drums, both of whom make definite contributions by staying under the music and supporting it. Taylor is one of my favorite drummers from that era simply because he could play any groove and do so unobtrusively. He manages the same here and is locked in with Heath to give the melody instruments a foundation.<br /><br />The album was recorded in a single session at Rudy van Gelder's Hackensack, NJ studio on August 5, 1955 and released the next year by Prestige as PRLP 7034. Some accounts of this session claim Miles' was disgusted with McLean for being high, but that is not evident in the playing.",[],B00KNZ0F3E,B00KNZ0F3E,AG3S4FROO422V5KP7DJCBXVUQLJQ,2015-07-07 13:55:56,1,False
4.0,Private recording with spotty sound and excellent music,"This album was recorded on January 24, 1980 for the Ornament label in Aachen, Germany (according to notes I researched it was in the home of Friedrich and Gabi Klemme.) The sound quality is a little on the muddy side and the snippets of 'crowd' noise that creep into the recording indicate that this was either a party or a private recital with possibly a dozen or more folks in attendance.<br /><br />The music is what counts and in my growing collection of Donegan recordings that is one thing that never disappoints. Here she is backed by George Linges on bass and Tony Mann on drums. While the title implies a slant towards Ellington, the only tribute to the Duke is the title track. Otherwise, it's a collection of mainly recognizable standards including two medleys that give Donegan room to show her amazing improvisational skills. She can do the seemingly impossible going from one song to the next, often quoting even more songs within the melody.<br /><br />Since there is no track list at the time of this review I am providing it:<br />1. Jumpin' at the Woodside<br />2. Medley: In the Mood/Mack the Knife<br />3. Medley: Sophisticated Lady/Dorothy's Themes<br />4. Smile<br />5. September in the Rain<br />6. Medley: Send in the Clowns/Jesse/You'll Never Walk Alone/If I Loved You/My way<br /><br />The album clocks in at 49:41, so there is a decent amount of music. I would not call this 'essential', but if you are a fan it's certainly worth grabbing. If you are a stickler for sound quality, though, you may want to pass this one up.",[],B000EMU4A0,B000EMU4A0,AG3S4FROO422V5KP7DJCBXVUQLJQ,2015-06-22 19:08:09,5,False
5.0,Comprehensive collection of Marmarosa's work,"Most of the tracks on this compilation were recorded in 1947 with Marmarosa as leader. The exception being is six tracks from a 1946 Lucky Thompson album called out below. Marmarosa is in excellent form on every track and if you are a pianist interested in this era of music (heavy bebop influence with his unique approach to the instrument) this set is a treasure trove.<br /><br />Sadly there are no sound samples on this page at the time of this review. Nor is there a track listing. I am going to provide the tracks and their sources, but they will be a little out of order because I am also going to include personnel, locations and other pertinent information to help you identify the context of each track. The album clocks in at a few seconds longer than an hour and eighteen minutes, so there is a lot of Mamarosa's recorded work here.<br /><br />The first ten track are from a Phoenix Jazz LP titled Dodo Marmarosa: Piano Man that was recorded in Los Angeles on July 16, 1947. Mamarosa is backed by Barney Kessel on guitar and Gene Englund on bass. Tracks are:<br />1. Dodo's Bounce<br />2. Opus #5<br />3. You Thrill Me<br />4. Compadoo<br />5. I'm In Love<br />6. Bopmatism<br />7. Lover Come Back To Me<br />8. Raindrops<br />9. Smoke Gets In Your Eyes<br />10. Escape<br /><br />Tracks 11 through 14 are from an Armed Forces Radio Service broadcast (11 and 12) and private recordings (13 and 14). 11 and 12 are from February 1946, and 13 and 14 were recorded on an unspecified date in 1947. All are solo and all were recorded in Los Angeles.<br />11. Deep Purple<br />12. Tea For Two<br />13. Tone Paintings I<br />14. Tone Paintings II<br /><br />Tracks 15 through 19 and alternate takes (tracks 26 through 30) are from a December 3, 1947 recording session for both the Spotlite and Dial labels in Los Angeles. Marmarosa is backed by Harry Babasin on cello and Jackie Mills on drums.<br />15. Bopmatism<br />16. Dodo's Dance<br />17. Trade Winds<br />18. Dary Departs<br />19. Cosmo Street<br /><br />26. Bopmatism<br />27. Dodo's Dance<br />28. Trade Winds<br />29. Dary Departs<br />30. Cosmo Street<br /><br />Tracks 20 through 25 are from a Lucky Thompson album recorded for the Down Beat label in Los Angeles on September 13, 1946. Thompson is the leader and tenor saxophonist backed by Marmarosa on piano, Red Callender on bass and Jackie Mills on drums.<br />20. Dodo's Bounce<br />21. Dodo's Lament<br />22. Slam's Mishap<br />23. Shuffle That Riff<br />24. Smooth Sailing<br />25. Commercial Eyes<br /><br />If you are studying Marmarosa the value of this set is obvious - especially since many of the source albums are now out-of-print.",[],B0007WPXS0,B0007WPXS0,AG3S4FROO422V5KP7DJCBXVUQLJQ,2015-06-06 19:15:41,2,False
