rating,title,text,images,asin,parent_asin,user_id,review_date,helpful_vote,verified_purchase
5.0,If you love Red Norvo ...,"You will love Teddy Charles on vibraphone on this album. This was Charles' eighth album as a leader (he was 29 when this was recorded in a single session for Jubilee in NYC on May 29, 1957. It was released later that year under catalog number JGM 1047. It clocks in at 39:47, so it's not super short like so many albums from the era.<br /><br />This is laid back with virtually no vibrato and the same relaxed playing that characterizes Red Norvo. You could not ask for better accompaniment with Oscar Pettiford on bass and Hal Overton on piano. I personally love the fact there there is no drummer because each track showcases Charles, Pettiford and Overton and drums would have been an intrusion. If you are new to Charles, he was a Julliard trained percussionist who was equally skilled on piano, vibraphone and drums.<br /><br />There is no track listing on this page at the time of this review so I am providing it - all Ellington tunes as the title implies:<br />A1  Main Stem  4:45<br />A2  Do Nothing 'Til You Hear From Me  5:06<br />A3  Sophisticated Lady  9:36<br />B1  Don't Get Around Much Anymore  5:57<br />B2  Sherman Shuffle  7:07<br />B3  The Mooch  6:20<br /><br />Overall, the music flows languorously with each member of the trio participating and playing off one another. Make no mistake that Charles is the centerpiece, but he gives ample space to both Pettiford and Overton. Also important (to me) is there no real liberties taken with the melodies of each track. The Duke, I am sure, approved when this album was released.<br /><br />I found my copy in a thrift shop and even on a cheap turntable and fair-to-good condition vinyl this album has reasonable sound quality. A copy in VG to pristine condition played on a decent turntable will be a real treat.",[],B00B5I7QNU,B00B5I7QNU,AG3S4FROO422V5KP7DJCBXVUQLJQ,2015-05-26 16:26:12,1,False
5.0,Laid back and bluesy,"This is one of Garland's late 50s albums he cut for Prestige's Moodsville subsidiary. This album should not be confused with a similar titled one featuring Garland's trio and Eddie Lockjaw Davis titled, [[ASIN:B000000YK4 Moodsville, Volume 1]]. At the time of this review there is no track list. The album contains the following tracks, which clock in at 43:26:<br />A1  I Love You Yes I Do<br />A2  Blues For Ann<br />A3  I'll Never Stop Loving You<br />B1  And The Angels Sing<br />B2  Tain't Nobody's Business<br />B3  Bassment Blues<br /><br />Every track is basically a  ballad or slow tempo blues. Great for late evening background (or romantic) music. For me it is not an album I frequently play, although the tracks are in a few playlists on my MP3 player for when I want to wind down and chill.<br /><br />Unfortunately there are no sound samples (at the time of this review) to be found anywhere on Amazon, but you can find most of the tracks if you search the web. If you are familiar with Garland during the late 50s you probably have a good idea how this album will sound. This is especially true since he has Paul Chambers on bass and Art Taylor on drums backing him. The three of them were one of the tightest piano jazz trios from the era and their music here as on other albums has a definite swing and cohesiveness.<br /><br />This was recorded at Rudy van Gelder's Hackensack, NJ studio on November 21, 1958 and released in 1960. If you want to add some slower trio music to your collection this is a prime candidate.",[],B0014TBEJW,B0014TBEJW,AG3S4FROO422V5KP7DJCBXVUQLJQ,2015-05-23 15:50:31,3,False
5.0,McCann live in 64,"This is a live performance circa 1964 (I have been unable to nail down the exact date). The even is the After Hours Concert at the Esquire Theater in Los Angeles and is much wider than Just McCann. This concert (and to a degree album) has some historic significance because McCann introduces Monty Alexander whose debut album was recorded at the same concert - both for the Pacific Jazz label. Alexander 'borrowed' McCann's rhythm section that was comprised of Victor Gaskin on bass and Paul Humphrey on drums.<br /><br />Aside from the playing this album has wonderful ambiance from the crowd. I will say that if you dislike crowd noise and interaction you are NOT going to like this album. I thought it added to the listening pleasure, but have to admit that it's a bit much in spots. Otherwise the album has excellent sound quality.<br /><br />At the time of this review there are no sound samples or a track list on this page. There are entire tracks floating around on the web that are easy to search out, and the track list is:<br />A1  El Soulo  3:16<br />A2  Lavande  6:40<br />A3  Spanish Onions  8:50<br />B1  Get Them Grits  4:30<br />B2  I Am In Love  5:30<br />B3  Arabella  5:43<br />B4  Maxie's Farewell  5:15<br /><br />With the exception of Cole Porter's I Am In Love, the album contains all of McCann's own compositions.",[],B0040ZI120,B0040ZI120,AG3S4FROO422V5KP7DJCBXVUQLJQ,2015-03-11 17:46:21,6,False
5.0,The album that launched Monty,"Note: there are a few albums by this title, one of which is a compilation. I am reviewing the vinyl LP titled [[ASIN:B006LMZBD2 Alexander The Great]] that Alexander recorded for Pacific Jazz during the After Hours Concert at the Esquire Theater in Los Angeles. This is Alexander's debut album that established him as a 'contender' in 1964.<br /><br />At the time of this review there is no track listing or sound samples on this page. I can provide the tracks:<br />A1 John Brown's Body 5:30<br />A2 Jitterbug Waltz 3:59<br />A3 Comin' Home Baby 5:45<br />A4 If I Were A Bell 6:18<br />B1 The Grabber 5:30<br />B2 Autumn Leaves 5:59<br />B3 I've Never Been In Love Before 5:30<br />B4 Blues For Jilly 4:40<br /><br />Since this was live it explains how two of Alexander's compositions (The Grabber and Blues for Jilly) made it on the album. Normally new artists stick with standards, which do comprise the remaining tracks. From the start you can hear Les McCann's influence on Alexander (indeed, McCann also performed at the concert and introduced Alexander).<br /><br />The rhythm section is comprised of  Victor Gaskin on bass and Paul Humphrey on drums. They also backed McCann at the same concert and I am under the impression that Alexander was there as a guest. I cannot be sure, but I am surmising that given McCann's unmistakable influence on Alexander's playing that continues to this day that there were some behind the scenes machinations that got Alexander on this album. If you are inclined to track down McCann's album from the same concert it's titled Les McCann - Spanish Onions Pacific Jazz PJ-10097.<br /><br />Sound quality on this LP is excellent, even on my cheap USB turntable, and if you are an Alexander fan this is ground zero in his career.",[],B006LMZBD2,B006LMZBD2,AG3S4FROO422V5KP7DJCBXVUQLJQ,2015-03-11 16:37:57,1,False
5.0,Interesting arrangements,"I've owned a copy of this album for decades and am reviewing the music and not the media nor the price.<br /><br />What I love is the arrangements, which are totally different from any I have heard. For example, Green Dolphin Street (as originally composed) has an ABAB format. The rendition on this album does too,  but the A section almost seamlessly segues into the B section. Nearly every other arrangement I've heard (and played) has an abrupt transition between the two. The other tracks are similar in that Sample takes a lot of liberties with the melody line as well as the phrasing and arrangements.<br /><br />Another thing is on this album Sample is back on an acoustic piano. I loved his playing on his earlier albums like Lighthouse 62 and Freedom Sound, and to be honest had drifted away when he and the Crusaders went the fusion route in the late 1960s/early 1970s. So this album is a nice change in that respect.<br /><br />Of course the rhythm section makes a lot of difference and having Ray Brown on bass practically guarantees that there would be a swinging pulse. As a drummer who has long admired Shelly Manne I have a personal reason for loving this album.<br /><br />Sadly there are no sound samples on this page, but if you are diligent and do a web search you will be rewarded with some. From those you can get a better picture of what I mean by arrangements being unique.<br /><br />This album was recorded in Los Angeles on November 28, 1975 for the Japanese label East Wind. Although the recording was done at the Warner Brothers Studios the production team was Japanese. The sound quality is superb. One final note: this product page at the time of this review does not contain a track listing. Here it is:<br />A1  Yearnin'  5:04<br />A2  On Green Dolphin Street 5:17<br />A3  Satin Doll 5:38<br />B1  Manha Do Carnaval  5:59<br />B2  Round About Midnight 4:34<br />B3  Funky Blues 5:10<br />Total play time is 29:53.",[],B002RH0ND8,B002RH0ND8,AG3S4FROO422V5KP7DJCBXVUQLJQ,2014-09-29 20:33:13,0,False
5.0,"Not all of the Trio sessions, but all are early LaFaro","This album is really a double album set that is  [[ASIN:B003OFC2SG SINGS WITH THE PAT MORAN TRIO]] with the trio comprised of Patti Moran [McCoy] on piano, Scott LaFaro on bass and Gene Gammage on drums backing Beverly Kelly on vocals, and [[ASIN:B004FBEQN2 This is Pat Moran]] featuring just the trio. Both albums are listed in various discographies as being recorded in December 1957, although the trio-only one is claimed by Moran-McCoy to have been recorded a year later. Not disputed is both were recorded in New York.<br /><br />Here are some discrepancies that make these an incomplete collection of the trio recordings: Track 20 does not show up in discographies, including the one dedicated to these two albums that span pages 262 through 264 in Lafaro's biography written by his sister: [[ASIN:1574412736 Jade Visions: The Life and Music of Scott LaFaro]]. Also missing from this album are Spring is Here and This Love of Mine, both of which are from the Kelly album, and Stella by Starlight, When Your Lover Has Gone and Farewells from the Trio album.<br /><br />Despite the fact that this does not contain all the tracks from the trio sessions, it does contain a record of LaFaro's genius even at 21. That alone merits five stars in my opinion in spite of some missing tracks.<br /><br />All discographies that I have checked, including LaFaro's biography cited above confirm that LaFaro was, in fact, the bassist and Gammage the drummer on all tracks.<br /><br />Sadly there are no sound samples here, nor on the Kelly album page, but there are on the Trio page, which will give you a good idea of the music on this album. If you are a bassist, jazz historian or musicologist, or a LaFaro fan this album is a treasure despite the discrepancies.",[],B000VPP00O,B000VPP00O,AG3S4FROO422V5KP7DJCBXVUQLJQ,2013-12-18 14:39:51,0,False
4.0,"Not exactly Hollywood, but a high energy jam session in nearby Inglewood","This album was recorded mere weeks after Chet Baker and Bird were 'home recorded' at the same venue. Like that album - [[ASIN:B005MVLS94 Bird & Chet: Live at the Trade Winds, 1952]], the sound quality on this one is not spectacular, but the music is. In fact some of the same musicians from the earlier session are on this one.<br /><br />Sadly there are no sound samples on this page at the time of this review. In a nutshell, this is mainly a horn-centric session with a young Chet Baker playing a lot more aggressively than he would on subsequent albums. There are two tracks where the ensemble downshifts and gives Al Haig a lot of room and places him in the front line: I'll Remember April and Sweet Georgia Brown.<br /><br />Here are the tracks:<br />1. There'll Never Be Another You<br />2. Bernie's Tune<br />3. My Old Flame<br />4. Avalon<br />5. I'll Remember April<br />6. How High The Moon<br />7. Sweet Georgia Brown<br /><br />If you love energetic music this is a great album. It was recorded live at the Trade Winds Club in Inglewood (a Los Angeles suburb) on August 4, 1952 and features the following line-up:<br /><br />Chet Baker on trumpet with Ted Ottison on trumpet on tracks 5 and 7, Sonny Criss on alto on tracks 1, 3 and 7, Jack Montrose on tenor sax on tracks 1, 4 and 7, Les Thompson on harmonica on track 4, and a rhythm section comprised of Al Haig on piano, Dave Bryant on bass and Larry Bunker on drums.",[],B000GEW86E,B000GEW86E,AG3S4FROO422V5KP7DJCBXVUQLJQ,2013-10-19 10:58:03,4,False
5.0,Exccellent collection of Mann mid-to-late 1950s,"Nearly every track in this compilation is excellent, although there is a handful that are marginal to my ears. I do not view that as a show-stopper, but if you are an audiophile you may want to spend the money and purchased each album in vinyl.<br /><br />Since there is no track list on this page at the time of this review I will include the tracks here. Also, I will list the original album titles, but in some cases will link to albums that have identical tracks but a lightly different title. More than a few reissues came out with slightly different titles. Also, I am not going to provide detailed information on each album because it would greatly clutter this page.  Here is what is on the four discs that are in this set:<br />==========<br />DISC ONE<br />==========<br />The first 11 tracks is the album titled [[ASIN:B00D0Z7HE4 The Herbie Mann - Sam Most Quintet]] and the remaining tracks is the album titled [[ASIN:B00006J3ZW Flute Flight]]:<br />01. Fascinating Rhythm<br />02. Why Do I Love You?<br />03. It's Only Sunshine<br />04. Love Letters<br />05. Let's Get Away from It All<br />06. Flying Home<br />07. I'll Remember April<br />08. Empathy<br />09. It Might as Well Be Spring<br />10. Just One of Those Things<br />11. Seven Comes Eleven<br />12. Tutti Flutie<br />13. Bo Do<br />14. Flute Bass Blues<br />15. Flute Bob<br />16. Solacium<br />==========<br />DISC TWO<br />==========<br />The first 8 tracks is the album titled [[ASIN:B000QZRMCI Flute Fraternity with Herbie Mann and Buddy Collette]] and the remaining tracks is the album originally titled Sultry Serenade, but is now issued as [[ASIN:B0055WHK92 Let Me Tell You]].<br />01. Herbie's Buddy<br />02. Perdido<br />03. Bangles and Beads Baubles<br />04. Give a Little Whistle<br />05. Here's Pete<br />06. Theme from 'Theme From'<br />07. Nancy with the Laughing Face<br />08. Morning After<br />09. Let Me Tell You<br />10. When the Sun Comes Out<br />11. Professor<br />12. Lazy Bones<br />13. Sultry Serenade<br />14. Little Man You've Had a Busy Day<br />15. One Morning In May<br />16. Swing Til the Girls Come Home<br />==========<br />DISC THREE<br />==========<br />The first four tracks are from the album titled Flute Souffle, but are now found on the same Let Me Tell you album cited for the previous disc. The remaining tracks on this disc are the album titled [[ASIN:B002G6ESH2 Yardbird Suite]].<br />01. Tel Aviv<br />02. Somewhere Else<br />03. Let's March<br />04. Chasin' the Bird<br />05. Yardbird Suite<br />06. Here's That Man<br />07. One for Tubby<br />08. Squire's Parlor<br />09. Who Knew<br />10. Opicana<br />==========<br />DISC FOUR<br />==========<br />The first six tracks are the album titled [[ASIN:B000000Z2L Just Wailin]] and the remaining tracks are the album titled [[ASIN:B000W178WA Flautista! Herbie Mann Plays Afro-Cuban Jazz]]. Note, that album contains bonus tracks that are not on this one.<br />01. Minor Groove<br />02. Gospel Truth<br />03. Blue Echoes<br />04. Trinidad<br />05. Jumpin' with Symphony Sid<br />06. Blue Dip<br />07. Todos Loco's<br />08. Cuban Potato Chip<br />09. Come On Mule<br />10. The Amazon River<br />11. Caravan<br /><br />Note that this is identical to an MP3 album that contains all 53 tracks in the same order, so if you want immediate gratification check it out: [[ASIN:B00EE7SQ7O The Jazz Collection Volume One]]. Even if you opt for physical discs visit that page and listen to the sound samples for an idea of both the sound quality and the music.<br /><br />Overall this is a great collection of Herbie's work at the height of his pure jazz period. He would continue to grow and experiment musically - sometimes in ways that lost him fans - but if you like the earlier period this set is golden.",[],B00C9RCUSC,B00C9RCUSC,AG3S4FROO422V5KP7DJCBXVUQLJQ,2013-09-04 16:56:51,0,False
5.0,First album veering towards pop,"Note that this album is out of print, but is part of a value-priced set titled [[ASIN:B00CSFXQZ6 8 Classic Albums]] as the first ten tracks on Disc Four.<br /><br />This 1962 album contains tracks that clearly show Lewis' strategy to move from a jazz piano trio format to more popular music (perhaps in response to Ray Charles' success in crossing over from R&B to pop.) The first five tracks on the album have a string section backing the trio.<br /><br />While the first five tracks comprising Side A is a foray into pop, Side B is still heavily rooted in jazz. The album has a consistent theme - Spring - and Lewis contributed three compositions to reinforce that theme. He wrote A1, A3 and B1, and B5 was written by bassist Eldee Young.  Since there is no track list at the time of this review here are the tracks on the album:<br /><br />SIDE A<br />A1  Sound Of Spring 2:30<br />A2  Spring Can Really Hang You Up The Most 4:25<br />A3  Blue Spring 3:00<br />A4  Spring Is Here 4:22<br />A5  Spring Will Be A Little Late This Year 2:43<br /><br />SIDE B<br />B1  Spring Fever  2:35<br />B2  It Might As Well Be Spring 3:52<br />B3  Soft Winds 3:10<br />B4  There'll Be Another Spring 2:30<br />B5  Truly, Truly Spring 3:27<br /><br />The trio is comprised of Ramsey Lewis on piano, Eldee Young on bass and Red Holt on drums. The album was recorded for Argo at the United Recordings Studio in Los Angeles on February 14 and 15, 1962 and released later that year. Interestingly Ruth Brown (credited as the single artist who made Atlantic Records a name) and Leonard Chess of Chess records have producer credits.",[],B001MPYMSI,B001MPYMSI,AG3S4FROO422V5KP7DJCBXVUQLJQ,2013-09-02 14:02:01,0,False
5.0,Eight great albums from 1955-59,"First: this is identical to an MP3 album that contains all 53 tracks in the same order, so if you want immediate gratification check it out: [[ASIN:B00EE7SQ7O The Jazz Collection Volume One]]. Even if you opt for physical discs visit that page and listen to the sound samples for an idea of both the sound quality and the music.<br /><br />Nearly every track in this compilation is excellent, although there is a handful that are marginal to my ears. I do not view that as a show-stopper, but if you are an audiophile you may want to spend the money and purchased each album in vinyl.<br /><br />Since there is no track list on this page at the time of this review I will include the tracks here. Also, I will list the original album titles, but in some cases will link to albums that have identical tracks but a lightly different title. More than a few reissues came out with slightly different titles. Also, I am not going to provide detailed information on each album because it would greatly clutter this page. See my review for the MP3 version of this set for that info.<br /><br />Here is what is on the four discs that are in this set:<br />==========<br />DISC ONE<br />==========<br />The first 11 tracks is the album titled [[ASIN:B00D0Z7HE4 The Herbie Mann - Sam Most Quintet]] and the remaining tracks is the album titled [[ASIN:B00006J3ZW Flute Flight]]:<br />01. Fascinating Rhythm<br />02. Why Do I Love You?<br />03. It's Only Sunshine<br />04. Love Letters<br />05. Let's Get Away from It All<br />06. Flying Home<br />07. I'll Remember April<br />08. Empathy<br />09. It Might as Well Be Spring<br />10. Just One of Those Things<br />11. Seven Comes Eleven<br />12. Tutti Flutie<br />13. Bo Do<br />14. Flute Bass Blues<br />15. Flute Bob<br />16. Solacium<br />==========<br />DISC TWO<br />==========<br />The first 8 tracks is the album titled [[ASIN:B000QZRMCI Flute Fraternity with Herbie Mann and Buddy Collette]] and the remaining tracks is the album originally titled Sultry Serenade, but is now issued as [[ASIN:B0055WHK92 Let Me Tell You]].<br />01. Herbie's Buddy<br />02. Perdido<br />03. Bangles and Beads Baubles<br />04. Give a Little Whistle<br />05. Here's Pete<br />06. Theme from 'Theme From'<br />07. Nancy with the Laughing Face<br />08. Morning After<br />09. Let Me Tell You<br />10. When the Sun Comes Out<br />11. Professor<br />12. Lazy Bones<br />13. Sultry Serenade<br />14. Little Man You've Had a Busy Day<br />15. One Morning In May<br />16. Swing Til the Girls Come Home<br />==========<br />DISC THREE<br />==========<br />The first four tracks are from the album titled Flute Souffle, but are now found on the same Let Me Tell you album cited for the previous disc. The remaining tracks on this disc are the album titled [[ASIN:B002G6ESH2 Yardbird Suite]].<br />01. Tel Aviv<br />02. Somewhere Else<br />03. Let's March<br />04. Chasin' the Bird<br />05. Yardbird Suite<br />06. Here's That Man<br />07. One for Tubby<br />08. Squire's Parlor<br />09. Who Knew<br />10. Opicana<br />==========<br />DISC FOUR<br />==========<br />The first six tracks are the album titled [[ASIN:B000000Z2L Just Wailin]] and the remaining tracks are the album titled [[ASIN:B000W178WA Flautista! Herbie Mann Plays Afro-Cuban Jazz]]. Note, that album contains bonus tracks that are not on this one.<br />01. Minor Groove<br />02. Gospel Truth<br />03. Blue Echoes<br />04. Trinidad<br />05. Jumpin' with Symphony Sid<br />06. Blue Dip<br />07. Todos Loco's<br />08. Cuban Potato Chip<br />09. Come On Mule<br />10. The Amazon River<br />11. Caravan<br /><br />Overall this is a great collection of Herbie's work at the height of his pure jazz period. He would continue to grow and experiment musically - sometimes in ways that lost him fans - but if you like the earlier period this set is golden.",[],B006TX2672,B006TX2672,AG3S4FROO422V5KP7DJCBXVUQLJQ,2013-09-01 13:37:04,7,False
5.0,Featuring Scott LaFaro on bass!,"This is one of two collaborations between one of that era's most promising bassists whose life was tragically cut short at 25 and Pat Moran who now goes by Patti Moran McCoy.<br /><br />The 12 tracks comprising this album were recorded in New York in late 1957 with the following personnel: Pat Moran on piano, Scott LaFaro on bass and Gene Gammage on drums backing vocalist Beverly Kelly. The bassist and drummer are sometimes incorrectly credited as bassist John Doling and drummer Johnny Whited, but according to Scott LaFaro's sister in her biography of him ([[ASIN:1574412736 Jade Visions: The Life and Music of Scott LaFaro]] it was indeed LaFaro and Gammage.<br /><br />Since there is no track list at the time of this review here is what is on the album:<br /><br />01. Lover Come Back To Me<br />02. The Man I Love<br />03. I Get A Kick Out Of You<br />04. I Wish I Knew<br />05. You Don't Know What Love Is<br />06. I'm Glad There Is You<br />07. Sometimes I'm Happy<br />08. You And The Night And The Music<br />09. But Not For Me<br />10. This Love Of Mine<br />11. Embraceable You<br />12. Spring Is Here<br /><br />Ten of these tracks are included in the double album titled [[ASIN:B000N2H8I2 Complete Trio Sessions]], which while missing some original tracks from this and the other album which comprises it may be a better value if you are not a completest.<br /><br />Sadly there are no sound samples on this page, but LaFaro's playing is clear and unmistakable.",[],B003OFC2SG,B003OFC2SG,AG3S4FROO422V5KP7DJCBXVUQLJQ,2013-02-09 16:10:14,2,False
